asin,overall,summary,reviewText
B000EXAMPLE01,5,Excellent purchase,"Arrived on time, well packaged. Works exactly as described and feels durable. Would buy again."
B000EXAMPLE01,2,Disappointing quality,"Stopped working after a month. Support was slow to respond. Not worth the price in my opinion."
B000EXAMPLE02,4,Good for the money,"Solid value. A few minor cosmetic flaws but nothing that affects daily use. Instructions could be clearer."
B000EXAMPLE02,1,Do not recommend,"Misleading photos. Item feels cheap and broke the first day. Requested a refund."
B000EXAMPLE03,5,Love it,"Best purchase this year. Simple setup and great performance. Friends asked where I bought it."
B000EXAMPLE03,3,It is okay,"Average product. Does the job but nothing special. Shipping took longer than expected."
B000EXAMPLE04,4,Nice design,"Looks great on the shelf. Runs quietly. Wish the cable was a bit longer but overall happy."
B000EXAMPLE04,2,Had issues,"Firmware bugs caused random restarts. After an update it improved slightly but still flaky."
